{
  "schema_version": 1,
  "plan_kind": "forward",
  "plan_id": "example-forward",
  "fingerprint_version": 1,
  "data_contract": 1,
  "identity_contract": 1,
  "supported_migration": "watershed.0006_watershed_utility_metadata",
  "materializer": {
    "image_digest": "sha256:2222222222222222222222222222222222222222222222222222222222222222",
    "git_commit": "3333333333333333333333333333333333333333"
  },
  "base": {
    "kind": "RELEASE",
    "release_id": "2026-07-16.1",
    "manifest_sha256": "4141414141414141414141414141414141414141414141414141414141414141",
    "release_fingerprint": "4242424242424242424242424242424242424242424242424242424242424242",
    "domain_fingerprint": "4343434343434343434343434343434343434343434343434343434343434343"
  },
  "target": {
    "kind": "RELEASE",
    "release_id": "2026-07-17.1",
    "manifest_sha256": "5151515151515151515151515151515151515151515151515151515151515151",
    "release_fingerprint": "5252525252525252525252525252525252525252525252525252525252525252",
    "domain_fingerprint": "5353535353535353535353535353535353535353535353535353535353535353"
  },
  "actions": [
    {
      "watershed_key": "example-north",
      "operation": "change",
      "before": {"runid": "illustrative/north-v1", "run_fingerprint": "6161616161616161616161616161616161616161616161616161616161616161", "capability_fingerprint": "6262626262626262626262626262626262626262626262626262626262626262"},
      "after": {"runid": "illustrative/north-v2", "run_fingerprint": "6363636363636363636363636363636363636363636363636363636363636363", "capability_fingerprint": "6464646464646464646464646464646464646464646464646464646464646464"},
      "change_channels": ["geometry", "capability"],
      "row_delta": {"watersheds": 0, "subcatchments": 1, "channels": 0}
    },
    {
      "watershed_key": "example-south",
      "operation": "retain",
      "before": {"runid": "illustrative/south", "run_fingerprint": "6565656565656565656565656565656565656565656565656565656565656565", "capability_fingerprint": null},
      "after": {"runid": "illustrative/south", "run_fingerprint": "6565656565656565656565656565656565656565656565656565656565656565", "capability_fingerprint": null},
      "change_channels": [],
      "row_delta": {"watersheds": 0, "subcatchments": 0, "channels": 0}
    },
    {
      "watershed_key": "example-west",
      "operation": "add",
      "before": null,
      "after": {"runid": "illustrative/west", "run_fingerprint": "6666666666666666666666666666666666666666666666666666666666666666", "capability_fingerprint": null},
      "change_channels": ["identity", "metadata", "geometry", "children"],
      "row_delta": {"watersheds": 1, "subcatchments": 3, "channels": 2}
    }
  ],
  "expected_row_delta": {"watersheds": 1, "subcatchments": 4, "channels": 2}
}
